{"id":"10000000-0000-4000-8000-000000000001","spaceId":"20000000-0000-4000-8000-000000000001","entityId":"30000000-0000-4000-8000-000000000001","deviceId":"40000000-0000-4000-8000-000000000001","memberId":"50000000-0000-4000-8000-000000000001","sequence":1,"payload":{"id":"30000000-0000-4000-8000-000000000001","amountMinor":"2800","currencyCode":"CNY","kind":"expense","occurredAt":"2026-09-10T03:00:00Z","note":"示例午饭"},"patch":{"amountMinor":"2800","note":"示例午饭"},"baseVersions":{},"baseVersion":0}
